{
	"name": "Addams Family Values",
	"year": 1993,
	"runtime": 94,
	"categories": [
	  "comedy",
	  "family"
	],
	"release-date": "1993-11-19",
	"director": "Barry Sonnenfeld",
	"writer": "Paul Rudnick",
	"actors": [
	  "Anjelica Huston",
	  "Raúl Juliá",
	  "Christopher Lloyd",
	  "Christina Ricci",
	  "Joan Cusack"
	],
	"storyline": "The Addams Family try to rescue their beloved uncle Fester from his gold-digging new love, a black widow named Debbie."
  }
  