{
  "name": "August Rush",
  "year": 2007,
  "runtime": 114,
  "categories": [
    "romance",
    "drama",
    "music"
  ],
  "release-date": "2007-11-21",
  "director": "Kirsten Sheridan",
  "writer": [
    "Nick Castle",
    "James V. Hart"
  ],
  "actors": [
    "Freddie Highmore",
    "Keri Russell",
    "Jonathan Rhys Meyers"
  ],
  "storyline": "A drama with fairy tale elements, where an orphaned musical prodigy uses his gift as a clue to finding his birth parents."
}
