{
  "name": "Saw VIII ",
  "year": 2017,
  "runtime": 92,
  "categories": [
    "horror",
    "mystery",
    "thriller"
  ],
  "release-date": "2017-11-23",
  "director": "Michael Spierig",
  "writer": "Josh Stolberg",
  "actors": [
    "Matt Passmore", 
    "Tobin Bell",
    "Callum Keith Rennie" 
  ]
}
