{
  "name": "Monty Python and the Holy Grail",
  "year": 1975,
  "runtime": 91,
  "categories": [
    "adventure",
    "comedy",
    "fantasy"
  ],
  "release-date": "1975-05-25",
  "director": [
    "Terry Gilliam",
    "Terry Jones"
  ],
  "writer": [
    "Graham Chapman",
    "John Cleese",
    "Eric Idle",
    "Terry Gilliam",
    "Terry Jones",
    "Michael Palin"
  ],
  "actors": [
    "Graham Chapman",
    "John Cleese",
    "Eric Idle"
  ]
}
