{
  "name": "The Last Starfighter",
  "year": 1984,
  "runtime": 101,
  "categories": [
    "sci-fi"
  ],
  "release-date": "1984-07-13",
  "director": "Nick Castle",
  "writer": [
    "Jonathan Betuel"
  ],
  "actors": [
    "Lance Guest",
    "Robert Preston",
    "Catherine Mary Stewart",
    "Dan O'Herlihy"
  ],
  "storyline": "After getting the high score on his favorite arcade game in the trailer park, Alex Rogan is taken away on the space ride of his life to fight evil where the game is real."
}
