{
  "name": "Juno",
  "year": 2007,
  "runtime": 96,
  "categories": [
    "comedy",
    "teen"
  ],
  "release-date": "2007-09-01",
  "director": "Jason Reitman",
  "writer": [
    "Diablo Cody"
  ],
  "actors": [
    "Ellen Page",
    "Michael Cera",
    "Jennifer Garner",
    "Jason Bateman",
    "Allison Janney",
    "J. K. Simmons"
  ],
  "storyline": "Sixteen-year-old Minnesota high-schooler Juno MacGuff discovers she is pregnant by her friend and longtime admirer, Paulie Bleeker."
}
