{
  "name": "22 July",
  "year": 2018,
  "runtime": 143,
  "categories": [
    "crime",
    "drama",
    "history"
  ],
  "release-date": "2018-10-10",
  "director": "Paul Greengrass",
  "writer": [
    "Paul Greengrass",
    "Åsne Seierstad"
  ],
  "actors": [
    "Anders Danielsen Lie",
    "Jonas Strand Gravli",
    "Jon Øigarden"
  ],
  "storyline": "In Norway on 22 July 2011, right-wing terrorist Anders Behring Breivik murdered 77 young people attending a Labour Party Youth Camp on Utøya Island outside of Oslo. A three-part story. About the survivors of the attacks, the political leadership of Norway, and the lawyers involved."
}
