{
  "name": "The Other Guys",
  "year": 2010,
  "runtime": 107,
  "categories": [
    "action",
    "comedy",
    "crime"
  ],
  "release-date": "2010-08-06",
  "director": "Adam McKay",
  "writer": [
    "Adam McKay",
    "Chris Henchy"
  ],
  "actors": [
    "Will Ferrell",
    "Mark Wahlberg",
    "Derek Jeter"
  ],
  "storyline": "Two mismatched New York City detectives seize an opportunity to step up like the city's top cops, whom they idolize, only things don't quite go as planned."
}