{
    "name": "Kuch Kuch Hota Hai",
    "year": 1998,
    "runtime": 177,
    "categories": [
      "comedy",
      "drama",
      "musical"
    ],
    "release-date": "1998-10-16",
    "director": "Karan Johar",
    "writer": [
      "Karan Johar",
      "Karan Johar"
    ],
    "actors": [
        "Shah Rukh Khan", "Kajol", "Rani Mukerji"
    ],
    "storyline": "During their college years, Anjali was in love with her best-friend Rahul, but he had eyes only for Tina. Years later, Rahul and the now-deceased Tina's eight-year-old daughter attempts to reunite her father and Anjali."
  }

   