{
    "name": "Bio-Dome",
    "year": 1996,
    "runtime": 88,
    "categories": [
      "comedy"
    ],
    "release-date": "1996-01-12",
    "director": "Jason Bloom",
    "writer": [
      "Adam Leff",
      "Mitchell Peck",
      "Jason Blumenthal",
      "Kip Koenig",
      "Scott Marcano"
    ],
    "actors": [
      "Pauly Shore",
      "Stephen Baldwin",
      "William Atherton",
      "Joey Adams"
    ],
    "storyline": "Bud and Doyle are here to save the world. But who's gonna save the world from Bud and Doyle?"
}