{
  "name": "Ana e Vit처ria",
  "year": 2018,
  "runtime": 115,
  "categories": [
    "biography",
    "comedy",
    "music"
  ],
  "release-date": "2018-08-02",
  "director": "Matheus Souza",
  "writer": [
    "Matheus Souza"
  ],
  "actors": [
    "Ana Caetano",
    "Vit처ria Falc찾o",
    "Clarissa M체ller",
    "Thati Lopes"
  ],
  "storyline": "Two girls have a chance encounter and instantly befriend. While trying to find themselves, they decide to pursue music together."
}
