{
  "name": "PASKAL",
  "year": 2018,
  "runtime": 115,
  "categories": [
    "action",
    "drama"
  ],
  "release-date": "2018-09-27",
  "director": "Adrian Teh",
  "writer": [
    "Anwari Ashraf",
    "Chee Ang Keoh",
    "Frank See",
    "Adrian Teh"
  ],
  "actors": [
    "Adi Afendi",
    "Ammar Alfian",
    "Hairul Azreen"
  ],
  "storyline": "PASKAL, or Pasukan Khas Laut, is an elite unit in the Royal Malaysian Navy. The movie follows the true events of PASKAL's Lieutenant Commander Arman Anwar and his team's mission to rescue a tanker, MV Bunga Laurel, that was hijacked by Somalian Pirates in 2011."
}
