{
    "name": "Kong: Skull Island",
    "year": 2017,
    "runtime": 118,
    "categories": [
      "thriller",
      "mystery"
    ],
    "release-date": "2017-03-10",
    "director": "Jordan Vogt-Roberts",
    "writer": [
      "Dan Gilroy",
      "Max Borenstein",
      "Derek Connolly",
      "John Gatins"
    ],
    "actors": [
      "Tom Hiddleston",
      "Samuel L. Jackson",
      "Brie Larson",
      "John C. Reilly"
    ],
    "storyline": "A washed up monster chaser convinces the U.S. Government to fund a trip to an unexplored island in the South Pacific. Under the guise of geological research, the team travels to Skull Island."
  }
  